[
  {
    "id": "hosp_001",
    "name": "St. Joseph's Hospital",
    "lat": 12.3413224,
    "lng": 76.6555307,
    "address": "Bannimantap, Mysuru, Karnataka 570015",
    "phone": "0821-2331066 (hospital line; emergency line shown on official site)",
    "type": "trust",
    "departments": [
      "Emergency & Trauma",
      "Intensive Care Unit",
      "General Medicine",
      "General Surgery",
      "Laparoscopy",
      "Obstetrics & Gynaecology",
      "Paediatrics",
      "Plastic Surgery",
      "Orthopaedics & Sports Medicine",
      "Neurology & Neurosurgery",
      "Nephrology & Dialysis",
      "Urology",
      "ENT",
      "Dental Surgery",
      "Endoscopy",
      "Dermatology",
      "Psychiatry",
      "Radiology & Imaging",
      "Laboratory & Pathology",
      "Blood Bank"
    ],
    "services": [
      "24/7 emergency and trauma care",
      "poison and overdose management",
      "snake-bite case management listed by ICU service",
      "stroke management",
      "road-traffic accident care",
      "severe breathing-difficulty management",
      "NICU support",
      "haemodialysis"
    ],
    "diagnostics": [
      "32-slice CT scan",
      "C-arm imaging",
      "ECG",
      "laboratory",
      "pathology",
      "digital X-ray"
    ],
    "capabilities": [
      "emergency_24x7",
      "icu",
      "nicu",
      "paediatrics",
      "obstetrics",
      "plastic_surgery",
      "orthopaedics",
      "neurology",
      "neurosurgery",
      "nephrology",
      "ct_scan",
      "blood_bank",
      "snake_bite_management",
      "poisoning_management",
      "toxicology_poison",
      "ventilator",
      "trauma_center"
    ],
    "last_verified": null,
    "verified_by": null,
    "source": "https://www.sjhmysuru.com/",
    "source_urls": [
      "https://www.sjhmysuru.com/",
      "https://www.sjhmysuru.com/departments",
      "https://www.sjhmysuru.com/departments/emergency-trauma",
      "https://www.sjhmysuru.com/departments/icu"
    ],
    "source_kind": "official_website",
    "research_checked_on": "2026-10-30",
    "verified": false,
    "location_verified": false,
    "location_source_url": "https://www.google.com/maps/search/?api=1&query=St.%20Joseph%27s%20Hospital%2C%20Bannimantap%2C%20Mysuru%2C%20Karnataka%20570015%2C%20Mysuru",
    "notes": "Official pages list 24/7 emergency/trauma care, ICU and ventilators; ICU page lists snake bites, poisoning, stroke and road-traffic accident care. Anti-snake venom stock is not represented. CT/blood-bank information is published on the hospital site. Public-source research only; call to verify current service scope and phone routing."
  },
  {
    "id": "hosp_002",
    "name": "JSS Hospital",
    "lat": 12.2959818,
    "lng": 76.6552185,
    "address": "M.G. Road, Ramachandra Agrahara, Mysuru, Karnataka 570004",
    "phone": "0821-2335000; 0821-2335500; 24/7 helpline 0821-2335555",
    "type": "trust",
    "departments": [
      "Emergency Medicine",
      "Critical Care Medicine",
      "Cardiology",
      "Cardiothoracic & Vascular Surgery",
      "Nephrology",
      "Urology",
      "Orthopaedics",
      "Neurology",
      "Neurosurgery",
      "Paediatrics",
      "Neonatology",
      "Obstetrics & Gynaecology",
      "Plastic Surgery",
      "Burns Care",
      "Radiology & Imaging",
      "Blood Bank"
    ],
    "services": [
      "24/7 emergency and trauma care",
      "cardiorespiratory and surgical emergency services",
      "obstetric and paediatric emergencies",
      "burns emergency services",
      "thrombolysis for acute stroke (CVA) listed by emergency department",
      "24/7 blood bank and regional blood transfusion centre",
      "multiple critical-care units including burns ICU, PICU and NICU"
    ],
    "diagnostics": [
      "3 Tesla MRI",
      "128-slice CT",
      "flat-panel cardiac catheterisation lab",
      "electrophysiology lab",
      "radiology and imaging",
      "laboratory services"
    ],
    "capabilities": [
      "emergency_24x7",
      "icu",
      "picu",
      "nicu",
      "paediatrics",
      "obstetrics",
      "burns_unit",
      "burns_care",
      "trauma_center",
      "orthopaedics",
      "neurology",
      "neurosurgery",
      "plastic_surgery",
      "cardiology",
      "cardiac_cath_lab",
      "stroke_unit",
      "ct_scan",
      "blood_bank",
      "ventilator",
      "nephrology",
      "urology"
    ],
    "last_verified": null,
    "verified_by": null,
    "source": "https://jsshospital.in/",
    "source_urls": [
      "https://jsshospital.in/",
      "https://jsshospital.in/facilities/technological-edge/",
      "https://jsshospital.in/facilities/critical-care-medicine/",
      "https://jsshospital.in/specialities/emergency-medicine/"
    ],
    "source_kind": "official_website",
    "research_checked_on": "2026-10-30",
    "verified": false,
    "location_verified": false,
    "location_source_url": "https://www.google.com/maps/search/?api=1&query=JSS%20Hospital%2C%20M.G.%20Road%2C%20Ramachandra%20Agrahara%2C%20Mysuru%2C%20Karnataka%20570004%2C%20Mysuru",
    "notes": "Official pages list 24x7 emergency/trauma, 260 ICU beds, ventilators, PICU/NICU and burns ICU; technology page lists 3T MRI, 128-slice CT, cath lab, EP lab and 24x7 blood bank. The department page lists emergency management for burns, paediatric and neurological emergencies. No live bed/stock information included."
  },
  {
    "id": "hosp_003",
    "name": "Apollo BGS Hospitals, Mysore",
    "lat": 12.2958525,
    "lng": 76.6324329,
    "address": "Adichuchanagiri Road, Kuvempunagar, Mysuru, Karnataka 570023",
    "phone": "0821-2568888 (public hospital directory; verify before production)",
    "type": "private",
    "departments": [
      "Emergency Medicine",
      "Critical Care",
      "Cardiology",
      "Neurology",
      "Nephrology",
      "Pulmonology",
      "Paediatrics",
      "Plastic Surgery",
      "Trauma Care",
      "Oncology",
      "Gastroenterology",
      "Urology",
      "Internal Medicine"
    ],
    "services": [
      "24/7 emergency and critical care",
      "cardiac emergency management",
      "stroke assessment and thrombolysis",
      "trauma and accident injury management",
      "respiratory emergency management",
      "poisoning and overdose cases listed by emergency service"
    ],
    "diagnostics": [
      "CT scan / emergency imaging",
      "radiology and imaging",
      "laboratory services"
    ],
    "capabilities": [
      "cardiology",
      "ct_scan",
      "emergency_department",
      "icu",
      "nephrology",
      "neurology",
      "paediatrics",
      "plastic_surgery",
      "poisoning_management",
      "pulmonology",
      "toxicology_poison",
      "trauma_center",
      "ventilator"
    ],
    "last_verified": null,
    "verified_by": null,
    "source": "https://www.apollohospitals.com/hospitals/apollo-bgs-hospitals-mysore",
    "source_urls": [
      "https://www.apollohospitals.com/hospitals/apollo-bgs-hospitals-mysore",
      "https://www.mysoremysuru.com/hospitals-and-emergency/"
    ],
    "source_kind": "official_website_plus_public_directory",
    "research_checked_on": "2026-10-30",
    "verified": false,
    "location_verified": false,
    "location_source_url": "https://www.google.com/maps/search/?api=1&query=Apollo%20BGS%20Hospitals%2C%20Mysore%2C%20Adichuchanagiri%20Road%2C%20Kuvempunagar%2C%20Mysuru%2C%20Karnataka%20570023%2C%20Mysuru",
    "notes": "Apollo Mysore official hospital page lists an Emergency Medicine service and specific cardiac emergency management, stroke assessment/thrombolysis, trauma and accident injury management, respiratory crises, poisoning/overdose and neurological emergencies. A local Mysuru directory advertises 24/7 emergency, but the 24/7 tag is not enabled from the official page alone; phone and operating hours should be confirmed."
  },
  {
    "id": "hosp_004",
    "name": "Narayana Multispeciality Hospital, Mysore",
    "lat": null,
    "lng": null,
    "address": "CAH/1, 3rd Phase, Devanur 2nd Stage, R.S. Naidu Nagar, Mysuru, Karnataka 570019",
    "phone": "1800-309-0309 (emergency); 080-6926-6140 (appointments; verify routing)",
    "type": "private",
    "departments": [
      "Emergency Medicine",
      "Cardiology",
      "Cardiothoracic Surgery",
      "Nephrology",
      "Neurology",
      "Orthopaedics",
      "Oncology",
      "Gastroenterology",
      "Internal Medicine",
      "Transplant Services"
    ],
    "services": [
      "24/7 emergency hospital services and on-duty emergency doctors",
      "42-bed critical-care ICU and 6-bed emergency unit listed on official Mysore page",
      "cardiac sciences and catheterisation laboratory",
      "two delivery suites",
      "dialysis services",
      "neurology, renal, orthopaedic and cancer-care specialities"
    ],
    "diagnostics": [
      "64-slice CT",
      "1.5 Tesla MRI",
      "mammography",
      "ultrasound",
      "digital X-ray",
      "EEG",
      "ENMG",
      "ECG",
      "ECHO",
      "TMT",
      "Holter monitoring",
      "cath lab"
    ],
    "capabilities": [
      "cardiac_cath_lab",
      "cardiology",
      "ct_scan",
      "emergency_24x7",
      "icu",
      "nephrology",
      "neurology",
      "obstetrics",
      "orthopaedics"
    ],
    "last_verified": null,
    "verified_by": null,
    "source": "https://www.narayanahealth.org/mysore/emergency-medicine",
    "source_urls": [
      "https://www.narayanahealth.org/mysore/emergency-medicine",
      "https://www.narayanahealth.org/hospitals-clinics/mysore/narayana-multispeciality-hospital-mysore",
      "https://www.narayanahealth.org/contact-us"
    ],
    "source_kind": "official_website",
    "research_checked_on": "2026-10-30",
    "verified": false,
    "location_verified": false,
    "location_source_url": null,